{
  "schemaVersion": 1,
  "project": {
    "id": "nemeda-agent-kit",
    "name": "Nemeda Agent Kit"
  },
  "repository": {
    "id": "nemeda-agent-kit",
    "role": "agent-toolkit",
    "profiles": ["javascript", "mcp", "agent-plugins"]
  },
  "context": {
    "instructions": ["AGENTS.md"],
    "documents": ["docs/architecture.md", "docs/configuration.md"]
  },
  "drive": {
    "provider": "google",
    "sharedDrive": "Nemeda",
    "links": {
      ".nemeda/memory": "agent-kit/memory"
    }
  },
  "memory": {
    "project": {
      "path": ".nemeda/memory",
      "tags": ["architecture", "memory", "meetings", "drive", "mcp", "release", "security"]
    },
    "central": {
      "mcpUrl": "https://memory.twyd.ai/mcp",
      "projectId": "nemeda-agent-kit"
    }
  },
  "tools": {
    "required": ["git", "github", "node"],
    "optional": ["codex", "claude"]
  },
  "policies": {
    "protectSecrets": true,
    "conversationLanguage": "es",
    "artifactLanguage": "en"
  }
}
